[
  {
    "id": "fp32",
    "displayName": "FP32",
    "effectiveBitsPerWeight": 32,
    "status": "active",
    "notes": "Full precision, no quantization",
    "sourceIds": ["common-knowledge"],
    "reviewedAt": "2026-06-01"
  },
  {
    "id": "fp16",
    "displayName": "FP16",
    "effectiveBitsPerWeight": 16,
    "status": "active",
    "notes": "Half precision",
    "sourceIds": ["common-knowledge"],
    "reviewedAt": "2026-06-01"
  },
  {
    "id": "q8_0",
    "displayName": "Q8_0",
    "effectiveBitsPerWeight": 8,
    "status": "active",
    "notes": "8-bit quantization (GGML type)",
    "sourceIds": ["ggml-format"],
    "reviewedAt": "2026-06-01"
  },
  {
    "id": "q6_k",
    "displayName": "Q6_K",
    "effectiveBitsPerWeight": 6,
    "status": "active",
    "notes": "6-bit K-quant",
    "sourceIds": ["ggml-format"],
    "reviewedAt": "2026-06-01"
  },
  {
    "id": "q5_k_m",
    "displayName": "Q5_K_M",
    "effectiveBitsPerWeight": 5,
    "status": "active",
    "notes": "5-bit K-quant medium",
    "sourceIds": ["ggml-format"],
    "reviewedAt": "2026-06-01"
  },
  {
    "id": "q4_k_m",
    "displayName": "Q4_K_M",
    "effectiveBitsPerWeight": 4,
    "status": "active",
    "notes": "4-bit K-quant medium (recommended)",
    "sourceIds": ["ggml-format"],
    "reviewedAt": "2026-06-01"
  },
  {
    "id": "q4_0",
    "displayName": "Q4_0",
    "effectiveBitsPerWeight": 4,
    "status": "deprecated",
    "notes": "4-bit legacy quantization; prefer q4_k_m",
    "sourceIds": ["ggml-format"],
    "reviewedAt": "2026-06-01"
  },
  {
    "id": "q3_k_m",
    "displayName": "Q3_K_M",
    "effectiveBitsPerWeight": 3,
    "status": "active",
    "notes": "3-bit K-quant medium",
    "sourceIds": ["ggml-format"],
    "reviewedAt": "2026-06-01"
  },
  {
    "id": "q2_k",
    "displayName": "Q2_K",
    "effectiveBitsPerWeight": 2,
    "status": "experimental",
    "notes": "2-bit K-quant; quality degrades significantly",
    "sourceIds": ["ggml-format"],
    "reviewedAt": "2026-06-01"
  }
]
